{
  "schemaVersion": "1.1",
  "productId": "finalsource",
  "profileVersion": "draft-2",
  "owner": "UNRESOLVED",
  "targetBuildRef": "sha256:a4bf2de79605708610c1717130fe5ef0b5a9b136c549069e85fc2b99ce10815c",
  "environment": {
    "kind": "staging",
    "identity": "UNVERIFIED-owner-environment"
  },
  "authorizationRef": "pending-finalsource-authority",
  "attackOrigins": [
    "http://172.18.0.2:3000"
  ],
  "dependencyOrigins": [],
  "healthPath": "/api/health",
  "healthAssertions": [
    {
      "pointer": "/success",
      "equals": true
    },
    {
      "pointer": "/data/status",
      "equals": "ok"
    }
  ],
  "crawlPath": "/api/health",
  "publicSeeds": [
    "/api/health"
  ],
  "schema": {
    "kind": "openapi",
    "sourceKind": "content",
    "path": "finalsource.public.openapi.json",
    "sha256": "abc7c58246156ffd5012bfd69a7ad62019bb375d5acdcb997ce4192d1f376529"
  },
  "expectedOperations": [
    {
      "method": "GET",
      "path": "/api/health",
      "status": 200
    }
  ],
  "allowedPaths": [
    "/api/health"
  ],
  "retentionDays": 30,
  "adapter": "docker-existing-http-v1",
  "binding": {
    "containerId": "8c33d47e59e59df56803530069245e9bfe1403a23cbc2557a288be1b7ae34b5f",
    "imageId": "sha256:a4bf2de79605708610c1717130fe5ef0b5a9b136c549069e85fc2b99ce10815c",
    "networkId": "3ad19445412a0b8af6b75290120ea4dc8089a035247e9cebaa74f0702d0a7d22",
    "address": "172.18.0.2",
    "startedAt": "2026-10-18T05:07:35.697103927Z"
  }
}
